"“the banking system is very st rong, well-capitalized, [and] highly liq uid.” With these banks already ","64073 Federal Register / Vol. 88, No. 179 / Monday, September 18, 2023 / Proposed Rules  144If the banking organization is an originating  banking organization with respect to the NPL  securitization, the banking organization may maintain risk-based capital against the transferred exposures as if they had not been securitized and must deduct from common equity tier 1 capital any after-tax gain-on-sale resulting from the transaction and any portion of a CEIO strip that does not constitute an after-tax gain-on-sale.  ",0.602522611618042
to higher capital requirements that simply arent necessary.   ,"64037 Federal Register / Vol. 88, No. 179 / Monday, September 18, 2023 / Proposed Rules  38For banking organizations that are not subject  to Category I or II capital standards, the current  capital rule does not have distinct treatments for significant and nonsignificant investments in the capital of unconsolidated financial institutions.",0.5767184495925903
"“the banking system is very st rong, well-capitalized, [and] highly liq uid.” With these banks already ","64148 Federal Register / Vol. 88, No. 179 / Monday, September 18, 2023 / Proposed Rules  422The agencies would expect a banking  organization to have sound internal capital  assessment processes which would include, but not be limited to, identification of capital adequacy goals with respect to risks, taking into account the strategic focus and business plan of the banking organization, risk identification, measurement, and documentation, as well as a process of internal controls, reviews and audits. the cash leg of the transaction could opt  into this treatment.",0.5606495141983032
"security and economy. Whatmore is that making banks hold on to more capital in their reserves is not necessary, as we already ","64073 Federal Register / Vol. 88, No. 179 / Monday, September 18, 2023 / Proposed Rules  144If the banking organization is an originating  banking organization with respect to the NPL  securitization, the banking organization may maintain risk-based capital against the transferred exposures as if they had not been securitized and must deduct from common equity tier 1 capital any after-tax gain-on-sale resulting from the transaction and any portion of a CEIO strip that does not constitute an after-tax gain-on-sale.  ",0.5551073551177979
"“the banking system is very st rong, well-capitalized, [and] highly liq uid.” With these banks already ","64083 Federal Register / Vol. 88, No. 179 / Monday, September 18, 2023 / Proposed Rules  178Recent research connecting operational risk to  higher business volume includes Frame, McLemore,  and Mihov (2020), Haste Makes Waste: Banking Organization Growth and Operational Risk, Federal Reserve Bank of Dallas, https://www.dallasfed.org/ research/papers/2020/wp2023; Curti, Frame, and  Mihov (2019), Are the Largest Banking Organizations Operationally More Risky?, Journal of Money, Credit and Banking Vol. 54, Issue 5, 1223– 1259, https://doi.org/10.1111/jmcb.12933; and  Abdymomunov and Curti (2020),",0.5479879975318909
to higher capital requirements that simply arent necessary.   ,"64110 Federal Register / Vol. 88, No. 179 / Monday, September 18, 2023 / Proposed Rules  293See section III.H.6.d of this SUPPLEMENTARY   INFORMATION for a more detailed discussion of the  capital add-on for re-designations. 294Separate capital calculations could  unnecessarily increase capital requirement because  they ignore the offsetting benefits between market risk covered positions held by trading desks subject to the internal models approach and those held by trading desks subject to the standardized approach.",0.5467576384544373
"“the banking system is very st rong, well-capitalized, [and] highly liq uid.” With these banks already ","64066 Federal Register / Vol. 88, No. 179 / Monday, September 18, 2023 / Proposed Rules  125For a given security or cash, a banking  organization may collect the security or cash in one  transaction and post it in another. Thus, at the portfolio level, the banking organization may, after netting across all transactions in the same portfolio, be either collecting the security or cash (that is, net borrowed) or posting the security or cash (that is,  net lent).",0.5464616417884827
"Sent: Thursday, November 09, 2023 8:03 AM","64172 Federal Register / Vol. 88, No. 179 / Monday, September 18, 2023 / Proposed Rules   477See 78 FR 62018 (October 11, 2013).  ",0.5420420169830322
"Sent: Thursday, November 09, 2023 8:03 AM","64300 Federal Register / Vol. 88, No. 179 / Monday, September 18, 2023 / Proposed Rules  (d) *",0.5265903472900391
"“the banking system is very st rong, well-capitalized, [and] highly liq uid.” With these banks already ","64037 Federal Register / Vol. 88, No. 179 / Monday, September 18, 2023 / Proposed Rules  38For banking organizations that are not subject  to Category I or II capital standards, the current  capital rule does not have distinct treatments for significant and nonsignificant investments in the capital of unconsolidated financial institutions.",0.523015022277832
"Sent: Thursday, November 09, 2023 8:03 AM","64337 Federal Register / Vol. 88, No. 179 / Monday, September 18, 2023 / Proposed Rules  purposes of this paragraph (f).  ",0.519860565662384
"security and economy. Whatmore is that making banks hold on to more capital in their reserves is not necessary, as we already ","64037 Federal Register / Vol. 88, No. 179 / Monday, September 18, 2023 / Proposed Rules  38For banking organizations that are not subject  to Category I or II capital standards, the current  capital rule does not have distinct treatments for significant and nonsignificant investments in the capital of unconsolidated financial institutions.",0.5172427892684937
"Sent: Thursday, November 09, 2023 8:03 AM","64158 Federal Register / Vol. 88, No. 179 / Monday, September 18, 2023 / Proposed Rules  II.",0.5148405432701111
to higher capital requirements that simply arent necessary.   ,"64111 Federal Register / Vol. 88, No. 179 / Monday, September 18, 2023 / Proposed Rules  298The respective components of the  standardized approach capital requirement are the  sensitivities-based method capital requirement, the standardized default risk capital requirement, and the residual risk add-on.   299The respective components of IMA totalare:  IMA G,A, SA U, SA all desks , SA G,A, SA i(as part of the  PLA add-on calculation), the capital add-on for certain securitization and correlation trading positions or equity positions in an investment fund on model-eligible trading desks, and any additional capital requirement established by the primary Federal supervisor.",0.5126872658729553
"security and economy. Whatmore is that making banks hold on to more capital in their reserves is not necessary, as we already ","64035 Federal Register / Vol. 88, No. 179 / Monday, September 18, 2023 / Proposed Rules  27Initially, the Board did not incorporate the  stress capital buffer requirement into the advanced  approaches capital conservation buffer requirement owing to the complexity involved in doing so.   28The Board’s Stress Testing Policy Statement  includes an assumption that the magnitude of a banking organization’s balance sheet will be fixed throughout the projection horizon under the supervisory stress test.",0.509596586227417
to higher capital requirements that simply arent necessary.   ,"64211 Federal Register / Vol. 88, No. 179 / Monday, September 18, 2023 / Proposed Rules  capital treatment under either this  subpart or subpart F, whichever results in the highest risk-based capital requirement.  ",0.5062971711158752
"have a robust financial sector. Federal Reserve Chairm an Jerome Powell has indi cated this, stating that ","64063 Federal Register / Vol. 88, No. 179 / Monday, September 18, 2023 / Proposed Rules  120See Basel Committee, ‘‘Strengthening the  resilience of the banking sector—consultative  document,’’ December 2009; https://www.bis.org/ publ/bcbs164.pdf. 121If the mutual fund qualifies for the full look-  through approach described in section III.E.1.c.ii of this  SUPPLEMENTARY INFORMATION but would be  treated as a market risk covered position as described in section III.H.3 of this  SUPPLEMENTARY   INFORMATION if the banking organization held the  mutual fund directly, the banking organization is permitted to apply the alternative method to calculate the haircut.",0.5031031370162964
to higher capital requirements that simply arent necessary.   ,"64094 Federal Register / Vol. 88, No. 179 / Monday, September 18, 2023 / Proposed Rules   233As the standardized approach is less risk-  sensitive than the internal models approach, to the  extent that the capital requirement under the internal models approach exceeds that under the  standardized approach for model-eligible desks, the proposal would require this difference to be reflected in the aggregate capital requirement under  the models-based measure for market risk.  ",0.502793550491333
"Sent: Thursday, November 09, 2023 8:03 AM","64338 Federal Register / Vol. 88, No. 179 / Monday, September 18, 2023 / Proposed Rules   * *",0.5027832388877869
"upheld to the highest standards.  in the world and required to pass econo mic stress tests to ensure stability, ","64089 Federal Register / Vol. 88, No. 179 / Monday, September 18, 2023 / Proposed Rules  200The interagency paper titled ‘‘Sound Practices  to Strengthen Operational Resilience’’ (November 2,  2020) notes that operational resilience ‘‘is the outcome of effective operational risk management combined with sufficient financial and operational resources to prepare, adapt, withstand, and recover from disruptions.’’ exposure is unlikely to be fully  eliminated over a short time frame.  ",0.5014687776565552
"“the banking system is very st rong, well-capitalized, [and] highly liq uid.” With these banks already ","64030 Federal Register / Vol. 88, No. 179 / Monday, September 18, 2023 / Proposed Rules  1The term ‘‘banking organizations’’ includes  national banks, state member banks, state  nonmember banks, Federal savings associations, state savings associations, top-tier bank holding companies domiciled in the United States not subject to the Board’s Small Bank Holding Company and Savings and Loan Holding Company  Policy Statement (12 CFR part 225, appendix C), U.S. intermediate holding companies of foreign banking organizations, and top-tier savings and loan holding companies domiciled in the United States, except for certain savings and loan holding companies that are substantially engaged in insurance underwriting or commercial activities and savings and loan holding companies that are subject to the Small Bank Holding Company and Savings and Loan Holding Company Policy Statement.  ",0.5002168416976929
