"Subject: [EXTERNAL MESSAGE] September 1, 2023 - R egulatory Capital Rule: Large Banking ","64037 Federal Register / Vol. 88, No. 179 / Monday, September 18, 2023 / Proposed Rules  38For banking organizations that are not subject  to Category I or II capital standards, the current  capital rule does not have distinct treatments for significant and nonsignificant investments in the capital of unconsolidated financial institutions.",0.6973537802696228
Large Banking organizations ,"64030 Federal Register / Vol. 88, No. 179 / Monday, September 18, 2023 / Proposed Rules  1The term ‘‘banking organizations’’ includes  national banks, state member banks, state  nonmember banks, Federal savings associations, state savings associations, top-tier bank holding companies domiciled in the United States not subject to the Board’s Small Bank Holding Company and Savings and Loan Holding Company  Policy Statement (12 CFR part 225, appendix C), U.S. intermediate holding companies of foreign banking organizations, and top-tier savings and loan holding companies domiciled in the United States, except for certain savings and loan holding companies that are substantially engaged in insurance underwriting or commercial activities and savings and loan holding companies that are subject to the Small Bank Holding Company and Savings and Loan Holding Company Policy Statement.  ",0.672683596611023
"Subject: [EXTERNAL MESSAGE] September 1, 2023 - R egulatory Capital Rule: Large Banking ","64148 Federal Register / Vol. 88, No. 179 / Monday, September 18, 2023 / Proposed Rules  422The agencies would expect a banking  organization to have sound internal capital  assessment processes which would include, but not be limited to, identification of capital adequacy goals with respect to risks, taking into account the strategic focus and business plan of the banking organization, risk identification, measurement, and documentation, as well as a process of internal controls, reviews and audits. the cash leg of the transaction could opt  into this treatment.",0.6584537029266357
"Subject: [EXTERNAL MESSAGE] September 1, 2023 - R egulatory Capital Rule: Large Banking ","64110 Federal Register / Vol. 88, No. 179 / Monday, September 18, 2023 / Proposed Rules  293See section III.H.6.d of this SUPPLEMENTARY   INFORMATION for a more detailed discussion of the  capital add-on for re-designations. 294Separate capital calculations could  unnecessarily increase capital requirement because  they ignore the offsetting benefits between market risk covered positions held by trading desks subject to the internal models approach and those held by trading desks subject to the standardized approach.",0.6523951292037964
"Subject: [EXTERNAL MESSAGE] September 1, 2023 - R egulatory Capital Rule: Large Banking ","64096 Federal Register / Vol. 88, No. 179 / Monday, September 18, 2023 / Proposed Rules  240The current capital rule defines a trading  position as one that is held by a banking  organization for the purpose of short-term resale or with the intent of benefiting from actual or expected short-term price movements or to lock-in arbitrage profits.",0.6430454254150391
"Subject: [EXTERNAL MESSAGE] September 1, 2023 - R egulatory Capital Rule: Large Banking ","64073 Federal Register / Vol. 88, No. 179 / Monday, September 18, 2023 / Proposed Rules  144If the banking organization is an originating  banking organization with respect to the NPL  securitization, the banking organization may maintain risk-based capital against the transferred exposures as if they had not been securitized and must deduct from common equity tier 1 capital any after-tax gain-on-sale resulting from the transaction and any portion of a CEIO strip that does not constitute an after-tax gain-on-sale.  ",0.6417752504348755
"Subject: [EXTERNAL MESSAGE] September 1, 2023 - R egulatory Capital Rule: Large Banking ","64302 Federal Register / Vol. 88, No. 179 / Monday, September 18, 2023 / Proposed Rules  significant investments in the capital of  an unconsolidated financial institution and, if applicable, any investments in a covered debt instrument subject to deduction under this paragraph (c)(5), exceeding the 10 percent threshold for non-significant investments, multiplied by  (B) The ratio of the national bank’s or  Federal savings association’s aggregate non-significant investments in the capital of an unconsolidated financial institution (in the form of such capital component) to the national bank’s or Federal savings association’s total non- significant investments in unconsolidated financial institutions, with an investment in a covered debt instrument being treated as tier 2 capital for this purpose.  ",0.637714684009552
"Subject: [EXTERNAL MESSAGE] September 1, 2023 - R egulatory Capital Rule: Large Banking ","64205 Federal Register / Vol. 88, No. 179 / Monday, September 18, 2023 / Proposed Rules  purposes of the collateral haircut  approach, except as provided in paragraph (c)(2)(ii) of this section, a [BANKING ORGANIZATION] must determine the exposure amount for a netting set of eligible margin loans or repo-style transactions according to the  following formula:  Where:  (A) E* is the exposure amount of the netting  set after credit risk mitigation;  (B) Eiis the current fair value of the  instrument, cash, or gold the [BANKING  ORGANIZATION] has lent, sold subject to repurchase, or posted as collateral to the counterparty;  (C) C iis the current fair value of the  instrument, cash, or gold the banking organization has borrowed, purchased subject to resale, or taken as collateral from the counterparty;  (D) net exposure = |SsEsHs||;  (E) gross exposure = SsEs|Hs|;  (F) Esis the absolute value of the net position  in a given instrument or in gold, where the net position in a given instrument or gold equals the sum of the current fair values of the instrument or gold the [BANKING ORGANIZATION] has lent,  sold subject to repurchase, or posted as collateral to the counterparty, minus the sum of the current fair values of that same instrument or gold the [BANKING ORGANIZATION] has borrowed, purchased subject to resale, or taken as collateral from the counterparty;  (G) H sis the haircut appropriate to E sas  described in Table 1 of this section, as applicable.",0.6216539740562439
"Subject: [EXTERNAL MESSAGE] September 1, 2023 - R egulatory Capital Rule: Large Banking ","64336 Federal Register / Vol. 88, No. 179 / Monday, September 18, 2023 / Proposed Rules  amount to be deducted under this  paragraph (c)(5) from a specific capital component is equal to:  (A) The FDIC-supervised institution’s  aggregate non-significant investments in the capital of an unconsolidated financial institution and, if applicable, any investments in a covered debt instrument subject to deduction under this paragraph (c)(5), exceeding the 10 percent threshold for non-significant investments, multiplied by  (B)",0.6129514575004578
"Subject: [EXTERNAL MESSAGE] September 1, 2023 - R egulatory Capital Rule: Large Banking ","64314 Federal Register / Vol. 88, No. 179 / Monday, September 18, 2023 / Proposed Rules  (B) The amount of funds in deposit  accounts at the custodial banking  organization that are linked to fiduciary or custodial and safekeeping accounts at the custodial banking organization.",0.6114429831504822
"Subject: [EXTERNAL MESSAGE] September 1, 2023 - R egulatory Capital Rule: Large Banking ","64168 Federal Register / Vol. 88, No. 179 / Monday, September 18, 2023 / Proposed Rules  461For credit risk revisions, almost all banking  organizations subject to Category I or II capital  standards, as well as two banking organizations subject to Category III capital standards, report their estimated impacts. For market risk revisions, only the top trading firms report their estimated impacts.  ",0.6085505485534668
"Subject: [EXTERNAL MESSAGE] September 1, 2023 - R egulatory Capital Rule: Large Banking ","64185 Federal Register / Vol. 88, No. 179 / Monday, September 18, 2023 / Proposed Rules  of the depository institution, foreign  bank, or credit union, and;  (ii) If applicable, the capital ratio  requirements for the well capitalized capital category under the regulations of the appropriate Federal banking agency implementing 12 U.S.C. 1831o or under similar regulations of the National Credit Union Administration.   (2) Notwithstanding paragraph (1) of  this definition, an exposure is not a Grade A bank exposure if:  (i) The capital ratios for the  depository institution, foreign bank, or credit union have not been publicly disclosed within the previous 6 months;  (ii) The external auditor of the  depository institution, foreign bank, or credit union has issued an adverse audit opinion or has expressed substantial doubt about the ability of the depository institution, foreign bank, or credit union to continue as a going concern within the previous 12 months; or  (iii) For a foreign bank, the capital  standards imposed by the home country supervisor on the foreign bank are not consistent with the Capital Accord of the Basel Committee on Banking Supervision.  ",0.6064430475234985
Large Banking organizations ,"64083 Federal Register / Vol. 88, No. 179 / Monday, September 18, 2023 / Proposed Rules  178Recent research connecting operational risk to  higher business volume includes Frame, McLemore,  and Mihov (2020), Haste Makes Waste: Banking Organization Growth and Operational Risk, Federal Reserve Bank of Dallas, https://www.dallasfed.org/ research/papers/2020/wp2023; Curti, Frame, and  Mihov (2019), Are the Largest Banking Organizations Operationally More Risky?, Journal of Money, Credit and Banking Vol. 54, Issue 5, 1223– 1259, https://doi.org/10.1111/jmcb.12933; and  Abdymomunov and Curti (2020),",0.6055354475975037
"Subject: [EXTERNAL MESSAGE] September 1, 2023 - R egulatory Capital Rule: Large Banking ","64146 Federal Register / Vol. 88, No. 179 / Monday, September 18, 2023 / Proposed Rules  414As described in more detail in section III.H.6.c  of this SUPPLEMENTARY INFORMATION , the fallback  capital requirement would apply in instances where  a banking organization is unable to apply the  internal models approach and the standardized approach to calculate market risk capital requirements.",0.6018112301826477
"Subject: [EXTERNAL MESSAGE] September 1, 2023 - R egulatory Capital Rule: Large Banking ","64294 Federal Register / Vol. 88, No. 179 / Monday, September 18, 2023 / Proposed Rules  jurisdictional liabilities, calculated in  accordance with the instructions to the FR Y–15 or equivalent reporting form.   (3) After meeting the criteria in  paragraph (2) of this definition, a national bank or Federal savings association continues to be a Category II national bank or Federal savings association until the national bank or Federal savings association has:  (i) Less than $700 billion in total  consolidated assets, as reported on the  Call Report, for each of the four most recent calendar quarters; and  (ii)(A) Less than $75 billion in cross-  jurisdictional activity for each of the four most recent calendar quarters.",0.6003979444503784
"Subject: [EXTERNAL MESSAGE] September 1, 2023 - R egulatory Capital Rule: Large Banking ","64177 Federal Register / Vol. 88, No. 179 / Monday, September 18, 2023 / Proposed Rules  internal models. Section  ll.212(b)(2)(i) of the market risk rule requires a banking organization that is subject to the market risk capital requirements to obtain the prior written approval of the primary Federal supervisor before using any internal model to calculate its risk-based capital requirements.  ",0.5990760922431946
"Subject: [EXTERNAL MESSAGE] September 1, 2023 - R egulatory Capital Rule: Large Banking ","64031 Federal Register / Vol. 88, No. 179 / Monday, September 18, 2023 / Proposed Rules  10Banking organizations’ risk-based capital ratios  are the common equity tier 1 capital ratio, tier 1  capital ratio, and total capital ratio.",0.5971227884292603
"Subject: [EXTERNAL MESSAGE] September 1, 2023 - R egulatory Capital Rule: Large Banking ","64066 Federal Register / Vol. 88, No. 179 / Monday, September 18, 2023 / Proposed Rules  125For a given security or cash, a banking  organization may collect the security or cash in one  transaction and post it in another. Thus, at the portfolio level, the banking organization may, after netting across all transactions in the same portfolio, be either collecting the security or cash (that is, net borrowed) or posting the security or cash (that is,  net lent).",0.5946072340011597
"Subject: [EXTERNAL MESSAGE] September 1, 2023 - R egulatory Capital Rule: Large Banking ","64040 Federal Register / Vol. 88, No. 179 / Monday, September 18, 2023 / Proposed Rules  56Overdrafts are past due and are considered  defaulted exposures once the obligor has breached  an advised limit or been advised of a limit smaller than the current outstanding balance. 57Under § ll.2 of the current capital rule,  investment grade means that the entity to which the  banking organization is exposed through a loan or  security, or the reference entity with respect to a credit derivative, has adequate capacity to meet financial commitments for the projected life of the asset or exposure.",0.5921217203140259
Organizations and Banking Organizations wi th Significant Trading Activity; Comment ,"64030 Federal Register / Vol. 88, No. 179 / Monday, September 18, 2023 / Proposed Rules  1The term ‘‘banking organizations’’ includes  national banks, state member banks, state  nonmember banks, Federal savings associations, state savings associations, top-tier bank holding companies domiciled in the United States not subject to the Board’s Small Bank Holding Company and Savings and Loan Holding Company  Policy Statement (12 CFR part 225, appendix C), U.S. intermediate holding companies of foreign banking organizations, and top-tier savings and loan holding companies domiciled in the United States, except for certain savings and loan holding companies that are substantially engaged in insurance underwriting or commercial activities and savings and loan holding companies that are subject to the Small Bank Holding Company and Savings and Loan Holding Company Policy Statement.  ",0.5900301933288574
"Subject: [EXTERNAL MESSAGE] September 1, 2023 - R egulatory Capital Rule: Large Banking ","64083 Federal Register / Vol. 88, No. 179 / Monday, September 18, 2023 / Proposed Rules  178Recent research connecting operational risk to  higher business volume includes Frame, McLemore,  and Mihov (2020), Haste Makes Waste: Banking Organization Growth and Operational Risk, Federal Reserve Bank of Dallas, https://www.dallasfed.org/ research/papers/2020/wp2023; Curti, Frame, and  Mihov (2019), Are the Largest Banking Organizations Operationally More Risky?, Journal of Money, Credit and Banking Vol. 54, Issue 5, 1223– 1259, https://doi.org/10.1111/jmcb.12933; and  Abdymomunov and Curti (2020),",0.5856037735939026
"Subject: [EXTERNAL MESSAGE] September 1, 2023 - R egulatory Capital Rule: Large Banking ","64063 Federal Register / Vol. 88, No. 179 / Monday, September 18, 2023 / Proposed Rules  120See Basel Committee, ‘‘Strengthening the  resilience of the banking sector—consultative  document,’’ December 2009; https://www.bis.org/ publ/bcbs164.pdf. 121If the mutual fund qualifies for the full look-  through approach described in section III.E.1.c.ii of this  SUPPLEMENTARY INFORMATION but would be  treated as a market risk covered position as described in section III.H.3 of this  SUPPLEMENTARY   INFORMATION if the banking organization held the  mutual fund directly, the banking organization is permitted to apply the alternative method to calculate the haircut.",0.5825956463813782
"Subject: [EXTERNAL MESSAGE] September 1, 2023 - R egulatory Capital Rule: Large Banking ","64275 Federal Register / Vol. 88, No. 179 / Monday, September 18, 2023 / Proposed Rules  the aggregate liquidity horizon-adjusted  ES-based measure. With prior written approval of [AGENCY], a [BANKING ORGANIZATION] also may include non-modellable risk factors in its internal models used to calculate the aggregate liquidity horizon-adjusted ES- based measure.  ",0.5799871683120728
"Subject: [EXTERNAL MESSAGE] September 1, 2023 - R egulatory Capital Rule: Large Banking ","64297 Federal Register / Vol. 88, No. 179 / Monday, September 18, 2023 / Proposed Rules  association subject to subpart E of this  part is the ratio of its tier 1 capital to total leverage exposure.",0.5775747299194336
"Subject: [EXTERNAL MESSAGE] September 1, 2023 - R egulatory Capital Rule: Large Banking ","64203 Federal Register / Vol. 88, No. 179 / Monday, September 18, 2023 / Proposed Rules  after counterparty delivery was due, the  [BANKING ORGANIZATION] must assign a 1,250 percent risk weight to the current fair value of the deliverables owed to the [BANKING ORGANIZATION].   (f) Total risk-weighted assets for  unsettled transactions.",0.5773501396179199
"Subject: [EXTERNAL MESSAGE] September 1, 2023 - R egulatory Capital Rule: Large Banking ","64091 Federal Register / Vol. 88, No. 179 / Monday, September 18, 2023 / Proposed Rules  212See section III.C.5 of this SUPPLEMENTARY   INFORMATION for a more detailed discussion on the  types of credit risk mitigants that a banking  organization would be allowed to recognize for  purposes of calculating risk-based capital requirements.  ",0.5751762986183167
"Subject: [EXTERNAL MESSAGE] September 1, 2023 - R egulatory Capital Rule: Large Banking ","64209 Federal Register / Vol. 88, No. 179 / Monday, September 18, 2023 / Proposed Rules  (B) CBequals the fair value of the net position  in a given security the [BANKING  ORGANIZATION] has borrowed, purchased subject to resale, or taken as collateral from the unregulated financial institution; and  (C) f Land fBare the respective haircut floors  given in Table 2 to this section for each security net lent (L) and net borrowed (B) by the [BANKING ORGANIZATION].   Risk-Weighted Assets for Securitization Exposures  §ll.130 Operational criteria for  recognizing the transfer of risk.  ",0.573034942150116
"Subject: [EXTERNAL MESSAGE] September 1, 2023 - R egulatory Capital Rule: Large Banking ","64112 Federal Register / Vol. 88, No. 179 / Monday, September 18, 2023 / Proposed Rules  301See sections III.H.6.c and III.H.6.d of this  SUPPLEMENTARY INFORMATION for a more detailed  discussion on the fallback capital requirement and  the capital add-on requirement for re-designations, respectively. 302Under the proposal, a banking organization  would have to separately calculate the potential  losses arising from the position’s sensitivity to  changes in interest rates and changes in the issuer’s credit spread.  ",0.5721426606178284
"Subject: [EXTERNAL MESSAGE] September 1, 2023 - R egulatory Capital Rule: Large Banking ","64036 Federal Register / Vol. 88, No. 179 / Monday, September 18, 2023 / Proposed Rules  29See 12 CFR 3.22(b) (OCC); 12 CFR 217.22(b)  (Board); 12 CFR 324.22(b) (FDIC). A banking  organization that made an opt-out election is currently required to adjust common equity tier 1 capital as follows: subtract any net unrealized holding gains and add any net unrealized holding losses on available-for-sale securities; subtract any accumulated net gains and add any accumulated net losses on cash flow hedges; subtract any amounts recorded in AOCI attributed to defined benefit postretirement plans resulting from the initial and subsequent application of the relevant GAAP standards that pertain to such plans (excluding, at the banking organization’s option, the portion relating to pension assets deducted under §ll.22(a)(5) of the current capital rule); and,  subtract any net unrealized holding gains and add any net unrealized holding losses on held-to- maturity securities that are included in AOCI.  ",0.5713593363761902
"Subject: [EXTERNAL MESSAGE] September 1, 2023 - R egulatory Capital Rule: Large Banking ","64078 Federal Register / Vol. 88, No. 179 / Monday, September 18, 2023 / Proposed Rules  162Consistent with the current capital rule, under  the proposal, an equity exposure to an investment  firm that is treated as a traditional securitization would be subject to due diligence requirements. If a banking organization is unable to demonstrate to the satisfaction of the primary Federal supervisor a comprehensive understanding of the features of an equity exposure that would materially affect the performance of the exposure, the proposal would require the banking organization to assign a risk weight of 1,250 percent to the equity exposure to the investment firm.  ",0.5689491033554077
"Subject: [EXTERNAL MESSAGE] September 1, 2023 - R egulatory Capital Rule: Large Banking ","64169 Federal Register / Vol. 88, No. 179 / Monday, September 18, 2023 / Proposed Rules  464Further breakdown by category shows that the  proposal would increase binding common equity  tier 1 capital requirements by an estimated 19 percent for holding companies subject to Category I or II capital standards, by an estimated 6 percent for Category III and IV domestic holding companies, and by an estimated 14 percent for Category III and IV intermediate holding companies of foreign banking organizations. The impact assessment focuses on common equity tier 1 capital because it is the highest quality of regulatory capital and its minimum regulatory requirements are risk-based.  ",0.5685277581214905
"Subject: [EXTERNAL MESSAGE] September 1, 2023 - R egulatory Capital Rule: Large Banking ","64333 Federal Register / Vol. 88, No. 179 / Monday, September 18, 2023 / Proposed Rules  collateral to the counterparty, and C iis  the fair value of the instruments, gold,  or cash that the FDIC-supervised institution has borrowed, purchased subject to resale, or received as  collateral from the counterparty:  E i* = max {0, [E i¥C i]}; and  (B)",0.567672848701477
Organizations and Banking Organizations wi th Significant Trading Activity; Comment ,"64083 Federal Register / Vol. 88, No. 179 / Monday, September 18, 2023 / Proposed Rules  178Recent research connecting operational risk to  higher business volume includes Frame, McLemore,  and Mihov (2020), Haste Makes Waste: Banking Organization Growth and Operational Risk, Federal Reserve Bank of Dallas, https://www.dallasfed.org/ research/papers/2020/wp2023; Curti, Frame, and  Mihov (2019), Are the Largest Banking Organizations Operationally More Risky?, Journal of Money, Credit and Banking Vol. 54, Issue 5, 1223– 1259, https://doi.org/10.1111/jmcb.12933; and  Abdymomunov and Curti (2020),",0.566188395023346
"Subject: [EXTERNAL MESSAGE] September 1, 2023 - R egulatory Capital Rule: Large Banking ","64327 Federal Register / Vol. 88, No. 179 / Monday, September 18, 2023 / Proposed Rules  Subpart N—Enhanced Prudential  Standards for Foreign Banking Organizations With Total Consolidated Assets of $100 Billion or More and Combined U.S. Assets of Less Than $100 Billion  ■77. In § 252.147, revise paragraph  (e)(1)(i) to read as follows:  § 252.147 U.S. intermediate holding  company requirement for foreign banking organizations with combined U.S. assets of less than $100 billion and U.S. non-branch assets of $50 billion or more.  ",0.5661435723304749
"Subject: [EXTERNAL MESSAGE] September 1, 2023 - R egulatory Capital Rule: Large Banking ","64331 Federal Register / Vol. 88, No. 179 / Monday, September 18, 2023 / Proposed Rules  would meet the definition of ‘‘Financial  institution’’ under this section but for the ownership interest thresholds set forth in paragraph (4)(i) of that definition.  ",0.5656226873397827
"Subject: [EXTERNAL MESSAGE] September 1, 2023 - R egulatory Capital Rule: Large Banking ","64325 Federal Register / Vol. 88, No. 179 / Monday, September 18, 2023 / Proposed Rules  BILLING CODE 6210–01–C; 6714–01–C; 4810–33–C  PART 225—BANK HOLDING  COMPANIES AND CHANGE IN BANK CONTROL (REGULATION Y)  ■62. The authority citation for part 225  continues to read as follows:  Authority: 12 U.S.C. 1817(j)(13), 1818,  1828(o), 1831i, 1831p–1, 1843(c)(8), 1844(b),  1972(1), 3106, 3108, 3310, 3331–3351, 3906, 3907, and 3909; 15 U.S.C. 1681s, 1681w, 6801, and 6805.  ",0.5651487112045288
Large Banking organizations ,"64066 Federal Register / Vol. 88, No. 179 / Monday, September 18, 2023 / Proposed Rules  125For a given security or cash, a banking  organization may collect the security or cash in one  transaction and post it in another. Thus, at the portfolio level, the banking organization may, after netting across all transactions in the same portfolio, be either collecting the security or cash (that is, net borrowed) or posting the security or cash (that is,  net lent).",0.5642865896224976
"Subject: [EXTERNAL MESSAGE] September 1, 2023 - R egulatory Capital Rule: Large Banking ","64171 Federal Register / Vol. 88, No. 179 / Monday, September 18, 2023 / Proposed Rules  dealers. For evidence that bank dealers commit less  capital to market-making activities, see Bessembinder, H., S. Jacobsen, W. Maxwell, and K. Venkataraman, 2018, ‘‘Capital Commitment and Illiquidity in Corporate Bonds,’’ Journal of Finance 73(4): 1615–1661, although this paper confirms that postcrisis transaction costs have not increased materially.",0.5633305311203003
"Subject: [EXTERNAL MESSAGE] September 1, 2023 - R egulatory Capital Rule: Large Banking ","64188 Federal Register / Vol. 88, No. 179 / Monday, September 18, 2023 / Proposed Rules  unconditionally guaranteed by the FDIC  or the National Credit Union Administration.   (ii) A [BANKING ORGANIZATION]  must assign a 20 percent risk weight to the portion of an exposure that is conditionally guaranteed by the U.S. government, its central bank, or a U.S.  government agency.",0.5626445412635803
