"Subject: [EXTERNAL MESSAGE] September 1, 2023 - R egulatory Capital Rule: Large Banking ","64320 Federal Register / Vol. 88, No. 179 / Monday, September 18, 2023 / Proposed Rules  (ii) A Board-regulated institution  subject to subpart E of this part must  deduct from common equity tier 1 capital elements the items listed in paragraph (d)(2)(i) of this section that are not deducted as a result of the application of the 10 percent common equity tier 1 capital deduction threshold, and that, in aggregate, exceed 17.65 percent of the sum of the Board- regulated institution’s common equity tier 1 capital elements, minus adjustments to and deductions from common equity tier 1 capital required under paragraphs (a) through (c) of this section, minus the items listed in paragraph (d)(2)(i) of this section (the 15 percent common equity tier 1 capital deduction threshold). Any goodwill that has been deducted under paragraph (a)(1) of this section can be excluded from the significant investments in the capital of unconsolidated financial institutions in the form of common stock. ",0.5616641044616699
"Subject: [EXTERNAL MESSAGE] September 1, 2023 - R egulatory Capital Rule: Large Banking ","64216 Federal Register / Vol. 88, No. 179 / Monday, September 18, 2023 / Proposed Rules  (2) If the [BANKING  ORGANIZATION]’s Business Indicator  is greater than $1 billion and less than or equal to $30 billion, Business Indicator Component = $120 million +  0.15 × (Business Indicator¥$1 billion).   (3) If the [BANKING  ORGANIZATION]’s Business Indicator is greater than $30 billion, Business Indicator Component = $4.47 billion +  0.18 × (Business Indicator¥$30 billion).  ",0.5605756640434265
"Subject: [EXTERNAL MESSAGE] September 1, 2023 - R egulatory Capital Rule: Large Banking ","64074 Federal Register / Vol. 88, No. 179 / Monday, September 18, 2023 / Proposed Rules  147While the proposal would require banking  organizations that are not subject to the proposed  market risk capital framework to calculate risk- weighted assets for all publicly traded equity exposures under the proposed equity framework, such entities typically do not have material equity exposures.   148See §ll.202 for the proposed definition of  market risk covered position.",0.5590481758117676
"Subject: [EXTERNAL MESSAGE] September 1, 2023 - R egulatory Capital Rule: Large Banking ","64043 Federal Register / Vol. 88, No. 179 / Monday, September 18, 2023 / Proposed Rules  71Covered debt instruments are subject to  deduction by banking organizations subject to  Category I or II capital standards similar to the deduction framework for exposures to capital instruments. See 12 CFR 3.22(c) (OCC); 12 CFR  217.22(c) (Board); 12 CFR 324.22(c) (FDIC).",0.558699369430542
"Subject: [EXTERNAL MESSAGE] September 1, 2023 - R egulatory Capital Rule: Large Banking ","64326 Federal Register / Vol. 88, No. 179 / Monday, September 18, 2023 / Proposed Rules  the covered savings and loan holding  company by regulation or order, including, as applicable, any regulatory capital ratios calculated under 12 CFR part 217 and the deductions required under 12 CFR 248.12.   * *",0.5583555102348328
Large Banking organizations ,"64148 Federal Register / Vol. 88, No. 179 / Monday, September 18, 2023 / Proposed Rules  422The agencies would expect a banking  organization to have sound internal capital  assessment processes which would include, but not be limited to, identification of capital adequacy goals with respect to risks, taking into account the strategic focus and business plan of the banking organization, risk identification, measurement, and documentation, as well as a process of internal controls, reviews and audits. the cash leg of the transaction could opt  into this treatment.",0.5576971173286438
"Subject: [EXTERNAL MESSAGE] September 1, 2023 - R egulatory Capital Rule: Large Banking ","64030 Federal Register / Vol. 88, No. 179 / Monday, September 18, 2023 / Proposed Rules  1The term ‘‘banking organizations’’ includes  national banks, state member banks, state  nonmember banks, Federal savings associations, state savings associations, top-tier bank holding companies domiciled in the United States not subject to the Board’s Small Bank Holding Company and Savings and Loan Holding Company  Policy Statement (12 CFR part 225, appendix C), U.S. intermediate holding companies of foreign banking organizations, and top-tier savings and loan holding companies domiciled in the United States, except for certain savings and loan holding companies that are substantially engaged in insurance underwriting or commercial activities and savings and loan holding companies that are subject to the Small Bank Holding Company and Savings and Loan Holding Company Policy Statement.  ",0.5550792813301086
"Subject: [EXTERNAL MESSAGE] September 1, 2023 - R egulatory Capital Rule: Large Banking ","64192 Federal Register / Vol. 88, No. 179 / Monday, September 18, 2023 / Proposed Rules  borrower that does not have a source of  repayment in the foreign currency equal to at least 90 percent of the annual payment amount from either income generated through ordinary business activities or from a contract with a financial institution that provides funds denominated in the foreign currency.   (h) Corporate exposures.",0.5528894662857056
Organizations and Banking Organizations wi th Significant Trading Activity; Comment ,"64066 Federal Register / Vol. 88, No. 179 / Monday, September 18, 2023 / Proposed Rules  125For a given security or cash, a banking  organization may collect the security or cash in one  transaction and post it in another. Thus, at the portfolio level, the banking organization may, after netting across all transactions in the same portfolio, be either collecting the security or cash (that is, net borrowed) or posting the security or cash (that is,  net lent).",0.5525485277175903
"Subject: [EXTERNAL MESSAGE] September 1, 2023 - R egulatory Capital Rule: Large Banking ","64276 Federal Register / Vol. 88, No. 179 / Monday, September 18, 2023 / Proposed Rules  covered savings and loan holding  company that is a banking organization as defined in 12 CFR 238.2, or a depository institution that is subject to these requirements or of a non-U.S. banking organization that is subject to comparable public disclosure requirements in its home jurisdiction is not required to make the disclosures required by paragraph (f) of this section.   (b) Timing.",0.5489692091941833
"Subject: [EXTERNAL MESSAGE] September 1, 2023 - R egulatory Capital Rule: Large Banking ","64306 Federal Register / Vol. 88, No. 179 / Monday, September 18, 2023 / Proposed Rules  (b) Expanded total risk-weighted  assets. Beginning July 1, 2025, a  national bank or Federal savings  association subject to subpart E of this part must comply with the requirements of subpart B of this part using transition expanded total risk-weighted assets as calculated under this paragraph in place of expanded total risk-weighted assets.",0.5452027320861816
Organizations and Banking Organizations wi th Significant Trading Activity; Comment ,"64073 Federal Register / Vol. 88, No. 179 / Monday, September 18, 2023 / Proposed Rules  144If the banking organization is an originating  banking organization with respect to the NPL  securitization, the banking organization may maintain risk-based capital against the transferred exposures as if they had not been securitized and must deduct from common equity tier 1 capital any after-tax gain-on-sale resulting from the transaction and any portion of a CEIO strip that does not constitute an after-tax gain-on-sale.  ",0.543470025062561
"Subject: [EXTERNAL MESSAGE] September 1, 2023 - R egulatory Capital Rule: Large Banking ","64211 Federal Register / Vol. 88, No. 179 / Monday, September 18, 2023 / Proposed Rules  capital treatment under either this  subpart or subpart F, whichever results in the highest risk-based capital requirement.  ",0.5406478047370911
"Subject: [EXTERNAL MESSAGE] September 1, 2023 - R egulatory Capital Rule: Large Banking ","64111 Federal Register / Vol. 88, No. 179 / Monday, September 18, 2023 / Proposed Rules  298The respective components of the  standardized approach capital requirement are the  sensitivities-based method capital requirement, the standardized default risk capital requirement, and the residual risk add-on.   299The respective components of IMA totalare:  IMA G,A, SA U, SA all desks , SA G,A, SA i(as part of the  PLA add-on calculation), the capital add-on for certain securitization and correlation trading positions or equity positions in an investment fund on model-eligible trading desks, and any additional capital requirement established by the primary Federal supervisor.",0.5400369763374329
"Subject: [EXTERNAL MESSAGE] September 1, 2023 - R egulatory Capital Rule: Large Banking ","64090 Federal Register / Vol. 88, No. 179 / Monday, September 18, 2023 / Proposed Rules  201In the case of a depository institution that is  not a consolidated subsidiary of a depository  institution holding company that is assigned a category under the capital rule",0.5382997989654541
"Subject: [EXTERNAL MESSAGE] September 1, 2023 - R egulatory Capital Rule: Large Banking ","64219 Federal Register / Vol. 88, No. 179 / Monday, September 18, 2023 / Proposed Rules  (b) Risk management-related  disclosure requirements. (1) The  [BANKING ORGANIZATION] must describe its risk management objectives and policies for the organization overall, in particular:  (i) How the business model  determines and interacts with the overall risk profile (e.g., the key risks  related to the business model and how each of these risks is reflected and described in the risk disclosures) and how the risk profile of the [BANKING ORGANIZATION] interacts with the risk tolerance approved by the board;  (ii) The risk governance structure,  including: responsibilities attributed throughout the [BANKING ORGANIZATION]",0.5381040573120117
"Subject: [EXTERNAL MESSAGE] September 1, 2023 - R egulatory Capital Rule: Large Banking ","64313 Federal Register / Vol. 88, No. 179 / Monday, September 18, 2023 / Proposed Rules  amount of any increase in the mark-to-  fair value of the purchased credit derivative that is recognized in common equity tier 1 capital; and  (4) Where the Board-regulated  institution purchases credit protection through a total return swap and records the net payments received on a credit derivative through which the Board- regulated institution provides credit protection in net income, but does not record offsetting deterioration in the mark-to-fair value of the credit derivative through which the Board- regulated institution provides credit protection in net income (either through reductions in fair value or by additions to reserves), the Board-regulated institution may not use the purchased credit protection to offset the effective notional principal amount of the related credit derivative through which the Board-regulated institution provides credit protection;  (v) Where a Board-regulated  institution acting as a principal has more than one repo-style transaction with the same counterparty and has offset the gross value of receivables due from a counterparty under reverse repurchase transactions by the gross value of payables under repurchase transactions due to the same counterparty, the gross value of receivables associated with the repo- style transactions less any on-balance  sheet receivables amount associated with these repo-style transactions included under paragraph (c)(2)(i) of this section, unless the following criteria are met:  (A) The offsetting transactions have  the same explicit final settlement date under their governing agreements;  (B)",0.5360831022262573
"Subject: [EXTERNAL MESSAGE] September 1, 2023 - R egulatory Capital Rule: Large Banking ","64054 Federal Register / Vol. 88, No. 179 / Monday, September 18, 2023 / Proposed Rules  94Under § ll.2 of the current capital rule, a  person or company controls a company if it: (1)  owns, controls, or holds with power to vote 25 percent or more of a class of voting securities of the company; or (2) consolidates the company for financial reporting purposes.",0.5353917479515076
"Subject: [EXTERNAL MESSAGE] September 1, 2023 - R egulatory Capital Rule: Large Banking ","64166 Federal Register / Vol. 88, No. 179 / Monday, September 18, 2023 / Proposed Rules  457For example, the SA–CVA calculation does  not fully account for the dependence between the  banking organization’s exposure to a counterparty and the counterparty’s credit quality.   458Any banking organization not subject to  Category I, II, III, or IV standards that becomes subject to Category I, II, III, or IV standards during the proposed transition period, would be eligible for the remaining time that the transition provisions  provide.",0.5343109965324402
"Subject: [EXTERNAL MESSAGE] September 1, 2023 - R egulatory Capital Rule: Large Banking ","64335 Federal Register / Vol. 88, No. 179 / Monday, September 18, 2023 / Proposed Rules  institution that relate to the subsidiary  multiplied by  (2) The total capital ratio the  subsidiary must maintain to avoid restrictions on distributions and discretionary bonus payments under § 324.11 or equivalent standards established by the subsidiary’s home country supervisor.  ",0.5333481431007385
Organizations and Banking Organizations wi th Significant Trading Activity; Comment ,"64148 Federal Register / Vol. 88, No. 179 / Monday, September 18, 2023 / Proposed Rules  422The agencies would expect a banking  organization to have sound internal capital  assessment processes which would include, but not be limited to, identification of capital adequacy goals with respect to risks, taking into account the strategic focus and business plan of the banking organization, risk identification, measurement, and documentation, as well as a process of internal controls, reviews and audits. the cash leg of the transaction could opt  into this treatment.",0.531558632850647
"Subject: [EXTERNAL MESSAGE] September 1, 2023 - R egulatory Capital Rule: Large Banking ","64109 Federal Register / Vol. 88, No. 179 / Monday, September 18, 2023 / Proposed Rules  290Notably, for securitization positions subject to  subpart F, the current capital rule provides a  standardized measurement method for capturing specific risks and a models-based measure capturing general risks for calculating market risk- weighted assets. 291A risk factor sensitivity is the change in value  of an instrument given a small movement in a risk factor that affects the instrument’s value.  ",0.5311965346336365
"Subject: [EXTERNAL MESSAGE] September 1, 2023 - R egulatory Capital Rule: Large Banking ","64156 Federal Register / Vol. 88, No. 179 / Monday, September 18, 2023 / Proposed Rules  439For a netting set consisting of a single  transaction (for example, a derivative contract that  is not subject to a QMNA), the effective maturity would equal the remaining contractual maturity of the derivative contract. 440See the definition of Investment Grade in the  capital rule.",0.5295386910438538
"Subject: [EXTERNAL MESSAGE] September 1, 2023 - R egulatory Capital Rule: Large Banking ","64296 Federal Register / Vol. 88, No. 179 / Monday, September 18, 2023 / Proposed Rules  and outstanding common stock of the  unconsolidated financial institution.   * *",0.5273523926734924
"Subject: [EXTERNAL MESSAGE] September 1, 2023 - R egulatory Capital Rule: Large Banking ","64067 Federal Register / Vol. 88, No. 179 / Monday, September 18, 2023 / Proposed Rules  126The transaction would also result in credit  (reduction) of $100 cash, but this would have no  impact on the banking organization’s risk-weighted assets as cash is assigned a 0 percent risk weight under § ll.111.   127See proposed § ll.112(b)(5)(iv).",0.5254460573196411
"Subject: [EXTERNAL MESSAGE] September 1, 2023 - R egulatory Capital Rule: Large Banking ","64299 Federal Register / Vol. 88, No. 179 / Monday, September 18, 2023 / Proposed Rules  however, that the minimum credit  conversion factor that may be assigned to an off-balance sheet exposure under this paragraph is 10 percent; and  (ix) For a national bank or Federal  savings association that is a clearing member:  (A) A clearing member national bank  or Federal savings association that guarantees the performance of a clearing member client with respect to a cleared  transaction must treat its exposure to the clearing member client as a derivative contract or repo-style transaction, as applicable, for purposes of determining its total leverage exposure;  (B) A clearing member national bank  or Federal savings association that guarantees the performance of a CCP with respect to a transaction cleared on behalf of a clearing member client must treat its exposure to the CCP as a derivative contract or repo-style transaction, as applicable, for purposes of determining its total leverage exposure;  (C) A clearing member national bank  or Federal savings association that does not guarantee the performance of a CCP with respect to a transaction cleared on behalf of a clearing member client may exclude its exposure to the CCP for purposes of determining its total leverage exposure;  (D) Notwithstanding paragraphs  (c)(2)(ix)(A) through (C) of this section, a national bank or Federal savings association that is a clearing member may exclude from its total leverage exposure the effective notional principal amount of credit protection sold through a credit derivative contract, or other similar instrument, that it clears on behalf of a clearing member client through a CCP as calculated in accordance with paragraph (c)(2)(iv) of this section; and  (E) A national bank or Federal savings  association may exclude from its total leverage exposure a clearing member’s exposure to a clearing member client for a derivative contract if the clearing member client and the clearing member are affiliates and consolidated for financial reporting purposes on the national bank’s or Federal savings association’s balance sheet.   (x) A custodial banking organization  shall exclude from its total leverage exposure the lesser of:  (A)",0.5248375535011292
"Subject: [EXTERNAL MESSAGE] September 1, 2023 - R egulatory Capital Rule: Large Banking ","64130 Federal Register / Vol. 88, No. 179 / Monday, September 18, 2023 / Proposed Rules  374An equity or credit index would be considered  well diversified if it contains a large number of  individual equity or credit positions, with no single position representing a substantial portion of the index’s total market value. 375See section III.H.7.a of this SUPPLEMENTARY   INFORMATION for a more detailed description on the  assignment of delta sensitivities to the prescribed  risk buckets under the proposed sensitivities-based method.",0.5235474705696106
Large Banking organizations ,"64073 Federal Register / Vol. 88, No. 179 / Monday, September 18, 2023 / Proposed Rules  144If the banking organization is an originating  banking organization with respect to the NPL  securitization, the banking organization may maintain risk-based capital against the transferred exposures as if they had not been securitized and must deduct from common equity tier 1 capital any after-tax gain-on-sale resulting from the transaction and any portion of a CEIO strip that does not constitute an after-tax gain-on-sale.  ",0.5229071378707886
"Subject: [EXTERNAL MESSAGE] September 1, 2023 - R egulatory Capital Rule: Large Banking ","64124 Federal Register / Vol. 88, No. 179 / Monday, September 18, 2023 / Proposed Rules  357The proposal would require a banking  organization to apply the highest risk weight that  is applicable under the investment limits of an equity position in an investment fund that may invest in primarily high-yield or distressed names under the fund’s mandate by first applying the highest risk weight that is applicable under the fund’s investment limits to defaulted instruments, followed by sub-speculative grade, then speculative grade, then investment grade securities. A banking organization may not recognize any offsetting or diversification benefit when calculating the average risk weight of the fund.",0.5210542678833008
"Subject: [EXTERNAL MESSAGE] September 1, 2023 - R egulatory Capital Rule: Large Banking ","64041 Federal Register / Vol. 88, No. 179 / Monday, September 18, 2023 / Proposed Rules  61Under § ll.2 of the current capital rule, a  depository institution means a depository  institution as defined in section 3 of the Federal Deposit Insurance Act, a foreign bank means a foreign bank as defined in section 211.2 of the Federal Reserve Board’s Regulation K (12 CFR 211.2) (other than a depository institution), and a credit union means an insured credit union as defined under the Federal Credit Union Act (12 U.S.C. 1751 et seq.).",0.5210418105125427
"Subject: [EXTERNAL MESSAGE] September 1, 2023 - R egulatory Capital Rule: Large Banking ","64075 Federal Register / Vol. 88, No. 179 / Monday, September 18, 2023 / Proposed Rules  151Consistent with the current capital rule, the  proposal would allow a banking organization to  choose not to hold risk-based capital against the counterparty credit risk of equity derivative contracts, as long as it does so for all such contracts. Where the equity derivative contracts are subject to a qualified master netting agreement, the proposal would require the banking organization to either include all or exclude all of the contracts from any measure used to determine counterparty credit risk exposure.",0.5209313035011292
"Subject: [EXTERNAL MESSAGE] September 1, 2023 - R egulatory Capital Rule: Large Banking ","64207 Federal Register / Vol. 88, No. 179 / Monday, September 18, 2023 / Proposed Rules  eligible margin loans or a holding  period longer than five business days for repo-style transactions that are not cleared transactions under the following conditions. If the number of trades in a netting set exceeds 5,000 at any time during a quarter, a [BANKING ORGANIZATION] must adjust the haircuts provided in paragraphs (c)(2)(iii)(A) and (B) of this section upward on the basis of a holding period of twenty business days for the following quarter except in the calculation of exposure amount for purposes of § ll.114.",0.5196619033813477
Organizations and Banking Organizations wi th Significant Trading Activity; Comment ,"64132 Federal Register / Vol. 88, No. 179 / Monday, September 18, 2023 / Proposed Rules  379Prices from a transaction or quote processed  through a trading platform or exchange would  satisfy this requirement for purposes of the proposed definition of real price.   380Banking organizations must ensure that  exchanges of price information among competitors or with third parties are not likely to include acts or omissions that could result in a violation of Federal antitrust laws, including the Sherman Act, 15 U.S.C. 1 et seq., and the Federal Trade Commission Act, 15 U.S.C. 41 et seq.  ",0.5196228623390198
"Subject: [EXTERNAL MESSAGE] September 1, 2023 - R egulatory Capital Rule: Large Banking ","64303 Federal Register / Vol. 88, No. 179 / Monday, September 18, 2023 / Proposed Rules  to common equity tier 1 capital under  paragraph (b) of this section. A national bank or Federal savings association  subject to subpart E of this part that elects to exclude DTAs relating to adjustments under paragraph (b) of this section also must exclude DTLs and must do so consistently in all future calculations.",0.5187172889709473
"Subject: [EXTERNAL MESSAGE] September 1, 2023 - R egulatory Capital Rule: Large Banking ","64135 Federal Register / Vol. 88, No. 179 / Monday, September 18, 2023 / Proposed Rules  390As discussed in section III.H.8.a.ii. I of this  SUPPLEMENTARY INFORMATION , a banking  organization may elect to either use (1) the full set  of risk factors employed by its internal risk management models and directly calculate the daily expected shortfall measure under the selected twelve-month period of stress or (2) an appropriate subset of modellable risk factors to estimate the potential losses that would be incurred throughout the selected stress period, which would require the banking organization to estimate a daily expected shortfall measure for both the current and stress period.  ",0.5186611413955688
Organizations and Banking Organizations wi th Significant Trading Activity; Comment ,"64037 Federal Register / Vol. 88, No. 179 / Monday, September 18, 2023 / Proposed Rules  38For banking organizations that are not subject  to Category I or II capital standards, the current  capital rule does not have distinct treatments for significant and nonsignificant investments in the capital of unconsolidated financial institutions.",0.5176873207092285
"Subject: [EXTERNAL MESSAGE] September 1, 2023 - R egulatory Capital Rule: Large Banking ","64093 Federal Register / Vol. 88, No. 179 / Monday, September 18, 2023 / Proposed Rules  230The internal models approach capital  requirements for model-eligible trading desks  would itself consist of four components: (1) the internally modelled capital requirement for modellable risk factors, (2) the stressed expected shortfall for non-modellable risk factors, (3) the standardized default risk capital requirement, and (4) the aggregate trading portfolio backtesting capital multiplier. See section III.H.8.a of this  SUPPLEMENTARY INFORMATION .",0.5173551440238953
"Subject: [EXTERNAL MESSAGE] September 1, 2023 - R egulatory Capital Rule: Large Banking ","64212 Federal Register / Vol. 88, No. 179 / Monday, September 18, 2023 / Proposed Rules   [BANKING ORGANIZATION] must  determine the exposure amount of the credit derivative under § ll.113.  ",0.5170745849609375
