The proposed  increase in capital re,"64110 Federal Register / Vol. 88, No. 179 / Monday, September 18, 2023 / Proposed Rules  293See section III.H.6.d of this SUPPLEMENTARY   INFORMATION for a more detailed discussion of the  capital add-on for re-designations. 294Separate capital calculations could  unnecessarily increase capital requirement because  they ignore the offsetting benefits between market risk covered positions held by trading desks subject to the internal models approach and those held by trading desks subject to the standardized approach.",0.7202419638633728
I am writing to express my deep concerns regarding  the proposed  increase in capital requirements  for financial ,"64110 Federal Register / Vol. 88, No. 179 / Monday, September 18, 2023 / Proposed Rules  293See section III.H.6.d of this SUPPLEMENTARY   INFORMATION for a more detailed discussion of the  capital add-on for re-designations. 294Separate capital calculations could  unnecessarily increase capital requirement because  they ignore the offsetting benefits between market risk covered positions held by trading desks subject to the internal models approach and those held by trading desks subject to the standardized approach.",0.6975431442260742
capital re,"64110 Federal Register / Vol. 88, No. 179 / Monday, September 18, 2023 / Proposed Rules  293See section III.H.6.d of this SUPPLEMENTARY   INFORMATION for a more detailed discussion of the  capital add-on for re-designations. 294Separate capital calculations could  unnecessarily increase capital requirement because  they ignore the offsetting benefits between market risk covered positions held by trading desks subject to the internal models approach and those held by trading desks subject to the standardized approach.",0.6885104179382324
capital re,"64037 Federal Register / Vol. 88, No. 179 / Monday, September 18, 2023 / Proposed Rules  38For banking organizations that are not subject  to Category I or II capital standards, the current  capital rule does not have distinct treatments for significant and nonsignificant investments in the capital of unconsolidated financial institutions.",0.6205819845199585
I am writing to express my deep concerns regarding  the proposed  increase in capital requirements  for financial ,"64111 Federal Register / Vol. 88, No. 179 / Monday, September 18, 2023 / Proposed Rules  298The respective components of the  standardized approach capital requirement are the  sensitivities-based method capital requirement, the standardized default risk capital requirement, and the residual risk add-on.   299The respective components of IMA totalare:  IMA G,A, SA U, SA all desks , SA G,A, SA i(as part of the  PLA add-on calculation), the capital add-on for certain securitization and correlation trading positions or equity positions in an investment fund on model-eligible trading desks, and any additional capital requirement established by the primary Federal supervisor.",0.6202950477600098
capital re,"64096 Federal Register / Vol. 88, No. 179 / Monday, September 18, 2023 / Proposed Rules  240The current capital rule defines a trading  position as one that is held by a banking  organization for the purpose of short-term resale or with the intent of benefiting from actual or expected short-term price movements or to lock-in arbitrage profits.",0.6142280697822571
I am writing to express my deep concerns regarding  the proposed  increase in capital requirements  for financial ,"64169 Federal Register / Vol. 88, No. 179 / Monday, September 18, 2023 / Proposed Rules  464Further breakdown by category shows that the  proposal would increase binding common equity  tier 1 capital requirements by an estimated 19 percent for holding companies subject to Category I or II capital standards, by an estimated 6 percent for Category III and IV domestic holding companies, and by an estimated 14 percent for Category III and IV intermediate holding companies of foreign banking organizations. The impact assessment focuses on common equity tier 1 capital because it is the highest quality of regulatory capital and its minimum regulatory requirements are risk-based.  ",0.6125138998031616
I am writing to express my deep concerns regarding  the proposed  increase in capital requirements  for financial ,"64078 Federal Register / Vol. 88, No. 179 / Monday, September 18, 2023 / Proposed Rules  162Consistent with the current capital rule, under  the proposal, an equity exposure to an investment  firm that is treated as a traditional securitization would be subject to due diligence requirements. If a banking organization is unable to demonstrate to the satisfaction of the primary Federal supervisor a comprehensive understanding of the features of an equity exposure that would materially affect the performance of the exposure, the proposal would require the banking organization to assign a risk weight of 1,250 percent to the equity exposure to the investment firm.  ",0.5990184545516968
I am writing to express my deep concerns regarding  the proposed  increase in capital requirements  for financial ,"64302 Federal Register / Vol. 88, No. 179 / Monday, September 18, 2023 / Proposed Rules  significant investments in the capital of  an unconsolidated financial institution and, if applicable, any investments in a covered debt instrument subject to deduction under this paragraph (c)(5), exceeding the 10 percent threshold for non-significant investments, multiplied by  (B) The ratio of the national bank’s or  Federal savings association’s aggregate non-significant investments in the capital of an unconsolidated financial institution (in the form of such capital component) to the national bank’s or Federal savings association’s total non- significant investments in unconsolidated financial institutions, with an investment in a covered debt instrument being treated as tier 2 capital for this purpose.  ",0.5848034620285034
I am writing to express my deep concerns regarding  the proposed  increase in capital requirements  for financial ,"64124 Federal Register / Vol. 88, No. 179 / Monday, September 18, 2023 / Proposed Rules  357The proposal would require a banking  organization to apply the highest risk weight that  is applicable under the investment limits of an equity position in an investment fund that may invest in primarily high-yield or distressed names under the fund’s mandate by first applying the highest risk weight that is applicable under the fund’s investment limits to defaulted instruments, followed by sub-speculative grade, then speculative grade, then investment grade securities. A banking organization may not recognize any offsetting or diversification benefit when calculating the average risk weight of the fund.",0.5790445804595947
I am writing to express my deep concerns regarding  the proposed  increase in capital requirements  for financial ,"64148 Federal Register / Vol. 88, No. 179 / Monday, September 18, 2023 / Proposed Rules  422The agencies would expect a banking  organization to have sound internal capital  assessment processes which would include, but not be limited to, identification of capital adequacy goals with respect to risks, taking into account the strategic focus and business plan of the banking organization, risk identification, measurement, and documentation, as well as a process of internal controls, reviews and audits. the cash leg of the transaction could opt  into this treatment.",0.5785080790519714
I am writing to express my deep concerns regarding  the proposed  increase in capital requirements  for financial ,"64211 Federal Register / Vol. 88, No. 179 / Monday, September 18, 2023 / Proposed Rules  capital treatment under either this  subpart or subpart F, whichever results in the highest risk-based capital requirement.  ",0.5554705262184143
I am writing to express my deep concerns regarding  the proposed  increase in capital requirements  for financial ,"64037 Federal Register / Vol. 88, No. 179 / Monday, September 18, 2023 / Proposed Rules  38For banking organizations that are not subject  to Category I or II capital standards, the current  capital rule does not have distinct treatments for significant and nonsignificant investments in the capital of unconsolidated financial institutions.",0.5491471290588379
I am writing to express my deep concerns regarding  the proposed  increase in capital requirements  for financial ,"64074 Federal Register / Vol. 88, No. 179 / Monday, September 18, 2023 / Proposed Rules  147While the proposal would require banking  organizations that are not subject to the proposed  market risk capital framework to calculate risk- weighted assets for all publicly traded equity exposures under the proposed equity framework, such entities typically do not have material equity exposures.   148See §ll.202 for the proposed definition of  market risk covered position.",0.547426164150238
I am writing to express my deep concerns regarding  the proposed  increase in capital requirements  for financial ,"64094 Federal Register / Vol. 88, No. 179 / Monday, September 18, 2023 / Proposed Rules   233As the standardized approach is less risk-  sensitive than the internal models approach, to the  extent that the capital requirement under the internal models approach exceeds that under the  standardized approach for model-eligible desks, the proposal would require this difference to be reflected in the aggregate capital requirement under  the models-based measure for market risk.  ",0.5418879985809326
I am writing to express my deep concerns regarding  the proposed  increase in capital requirements  for financial ,"64336 Federal Register / Vol. 88, No. 179 / Monday, September 18, 2023 / Proposed Rules  amount to be deducted under this  paragraph (c)(5) from a specific capital component is equal to:  (A) The FDIC-supervised institution’s  aggregate non-significant investments in the capital of an unconsolidated financial institution and, if applicable, any investments in a covered debt instrument subject to deduction under this paragraph (c)(5), exceeding the 10 percent threshold for non-significant investments, multiplied by  (B)",0.5411980748176575
I am writing to express my deep concerns regarding  the proposed  increase in capital requirements  for financial ,"64093 Federal Register / Vol. 88, No. 179 / Monday, September 18, 2023 / Proposed Rules  230The internal models approach capital  requirements for model-eligible trading desks  would itself consist of four components: (1) the internally modelled capital requirement for modellable risk factors, (2) the stressed expected shortfall for non-modellable risk factors, (3) the standardized default risk capital requirement, and (4) the aggregate trading portfolio backtesting capital multiplier. See section III.H.8.a of this  SUPPLEMENTARY INFORMATION .",0.5269957780838013
I am writing to express my deep concerns regarding  the proposed  increase in capital requirements  for financial ,"64239 Federal Register / Vol. 88, No. 179 / Monday, September 18, 2023 / Proposed Rules  (c) Treatment of hybrid instruments in  the standardized approach capital  requirement. For purposes of calculating  the standardized approach capital requirement, a [BANKING ORGANIZATION] must assign risk sensitivities of hybrid instruments into the applicable risk classes such as interest rate, credit spread, and equity risk for calculating the delta, vega, and curvature capital requirements.",0.5245490074157715
I am writing to express my deep concerns regarding  the proposed  increase in capital requirements  for financial ,"64036 Federal Register / Vol. 88, No. 179 / Monday, September 18, 2023 / Proposed Rules  29See 12 CFR 3.22(b) (OCC); 12 CFR 217.22(b)  (Board); 12 CFR 324.22(b) (FDIC). A banking  organization that made an opt-out election is currently required to adjust common equity tier 1 capital as follows: subtract any net unrealized holding gains and add any net unrealized holding losses on available-for-sale securities; subtract any accumulated net gains and add any accumulated net losses on cash flow hedges; subtract any amounts recorded in AOCI attributed to defined benefit postretirement plans resulting from the initial and subsequent application of the relevant GAAP standards that pertain to such plans (excluding, at the banking organization’s option, the portion relating to pension assets deducted under §ll.22(a)(5) of the current capital rule); and,  subtract any net unrealized holding gains and add any net unrealized holding losses on held-to- maturity securities that are included in AOCI.  ",0.5241687297821045
I am writing to express my deep concerns regarding  the proposed  increase in capital requirements  for financial ,"64240 Federal Register / Vol. 88, No. 179 / Monday, September 18, 2023 / Proposed Rules  applicable risk weight. If more than one  risk weight can be applied to a given exposure under the sensitivities-based capital requirement, the maximum risk weight applicable must be used; or  (2) A hypothetical portfolio based on  the most recent quarterly disclosure of the investment fund’s historical holdings of underlying positions.  ",0.5228115916252136
I am writing to express my deep concerns regarding  the proposed  increase in capital requirements  for financial ,"64109 Federal Register / Vol. 88, No. 179 / Monday, September 18, 2023 / Proposed Rules  290Notably, for securitization positions subject to  subpart F, the current capital rule provides a  standardized measurement method for capturing specific risks and a models-based measure capturing general risks for calculating market risk- weighted assets. 291A risk factor sensitivity is the change in value  of an instrument given a small movement in a risk factor that affects the instrument’s value.  ",0.5144295692443848
I am writing to express my deep concerns regarding  the proposed  increase in capital requirements  for financial ,"64185 Federal Register / Vol. 88, No. 179 / Monday, September 18, 2023 / Proposed Rules  of the depository institution, foreign  bank, or credit union, and;  (ii) If applicable, the capital ratio  requirements for the well capitalized capital category under the regulations of the appropriate Federal banking agency implementing 12 U.S.C. 1831o or under similar regulations of the National Credit Union Administration.   (2) Notwithstanding paragraph (1) of  this definition, an exposure is not a Grade A bank exposure if:  (i) The capital ratios for the  depository institution, foreign bank, or credit union have not been publicly disclosed within the previous 6 months;  (ii) The external auditor of the  depository institution, foreign bank, or credit union has issued an adverse audit opinion or has expressed substantial doubt about the ability of the depository institution, foreign bank, or credit union to continue as a going concern within the previous 12 months; or  (iii) For a foreign bank, the capital  standards imposed by the home country supervisor on the foreign bank are not consistent with the Capital Accord of the Basel Committee on Banking Supervision.  ",0.5134145617485046
capital re,"64148 Federal Register / Vol. 88, No. 179 / Monday, September 18, 2023 / Proposed Rules  422The agencies would expect a banking  organization to have sound internal capital  assessment processes which would include, but not be limited to, identification of capital adequacy goals with respect to risks, taking into account the strategic focus and business plan of the banking organization, risk identification, measurement, and documentation, as well as a process of internal controls, reviews and audits. the cash leg of the transaction could opt  into this treatment.",0.5099865794181824
capital re,"64178 Federal Register / Vol. 88, No. 179 / Monday, September 18, 2023 / Proposed Rules  488In certain circumstances, a firm may be  required to re-submit its capital plan. See 12 CFR  225.8(e)(4); 12 CFR 238.170(e)(4).",0.5050535798072815
The proposed  increase in capital re,"64211 Federal Register / Vol. 88, No. 179 / Monday, September 18, 2023 / Proposed Rules  capital treatment under either this  subpart or subpart F, whichever results in the highest risk-based capital requirement.  ",0.5047745108604431
capital re,"64031 Federal Register / Vol. 88, No. 179 / Monday, September 18, 2023 / Proposed Rules  10Banking organizations’ risk-based capital ratios  are the common equity tier 1 capital ratio, tier 1  capital ratio, and total capital ratio.",0.5035057067871094
I am writing to express my deep concerns regarding  the proposed  increase in capital requirements  for financial ,"64035 Federal Register / Vol. 88, No. 179 / Monday, September 18, 2023 / Proposed Rules  27Initially, the Board did not incorporate the  stress capital buffer requirement into the advanced  approaches capital conservation buffer requirement owing to the complexity involved in doing so.   28The Board’s Stress Testing Policy Statement  includes an assumption that the magnitude of a banking organization’s balance sheet will be fixed throughout the projection horizon under the supervisory stress test.",0.5019638538360596
"Sent: Friday, November 10, 2023 2:21 PM","64172 Federal Register / Vol. 88, No. 179 / Monday, September 18, 2023 / Proposed Rules   477See 78 FR 62018 (October 11, 2013).  ",0.5017257332801819
